Term	Description
1TR	One True Recovery; booting into macOS recovery on Apple Silicon by holding the power button to verify physical presence; enables interaction with SEP to change Boot Policy
AA	Apple Account
AA	Apple Archive, see also Apple Encrypted Archive; command line tools: aa, aea, compression_tool
AAC	Automatic Assessment Configuration; AutomaticAssessmentConfiguration.framework; puts device in a locked mode for exam-style test applications
AAT	Apple Advanced Typography; font format and rendering engine
Accounts	launchd service: com.apple.accountsd; /System/Library/Accounts
ACDC	Apple Chips in Data Centers; see PCC
ACDE	Apple Connect Device External? ACDEClient.framework, old two-step verification, derived from a company-internal AppleConnect system?
ACFS	Apple Clustered File System; deprecated file system for Xsan; acfs.framework
Acoustic ID	song recognition and matching with Apple catalog, playback on HomePod; /System/Library/Components/AudioDSP.component
Activation	cryptographic check-in with iCloud to lock devices reported by the user as lost; verified by iBoot; MobileActivationMacOS.framework; launchd service: com.apple.mobileactivationd; servers: humb.apple.com, albert.apple.com
Activity	jobs, coarse-grained work units of applications; tracked by the system across XPC, bears a QoS class for scheduling; low-level mechanism not to be confused with User Activity
AE	Apple Events; messaging system to invoke application functionality; CoreServices.framework/AE.framework; launchd services: com.apple.coreservices.appleevents, com.apple.AEServer (AE over network)
Aegir	astronomy watch face and lock screen; /System/Library/CoreServices/AegirProxyApp.app
AFM	Apple Foundation Model; pre-trained transformer and diffusion models for Greymatter, optimized for on-device use by quantization (with accuracy-recovery adapters) and palletization; command line tool: modelcatalogdump
AGC	Apple Graphics Control, management of multiple displays and display port connections; launchd service: com.apple.displaypolicyd
AHAP	Apple Haptic Audio Pattern; file format for simultaneous audio and haptic data; CoreHaptics.framework
AIR	Apple Intermediate Representation; synthetic bytecode architecture target for GPU binary toolchain
ALF	Application-Layer Firewall; implemented as a Network Extension (see System Extension); launchd service: com.apple.alf (socketfilterfw); command line tool: socketfilterfw
Alloy	substrate for communication between user devices over Bluetooth and devices to iCloud, implemented over IDS; /System/Library/IdentityServices/ServiceDefinitions; launchd service: com.apple.identityservicesd
ALS	Ambient Light Sensor, AmbientDisplay.framework
Amber	Swift UI; SwiftUI.framework
AMFI	Apple Mobile File Integrity, checks code integrity based on code signature, stronger enforcement with hardened runtime, validates entitlement restrictions and environment constraints (launch constraints, library constraints); launchd service: com.apple.MobileFileIntegrity (amfid, invoked by kernel through host special port 18); disabled by setting amfi_get_out_of_my_way=0x1 in boot-args
AMP	Apple Media Protocol? former parts of iTunes for iPod and iOS device access in Finder, Home Sharing; AMPDevices.framework, AMPSharing.framework; launchd services: com.apple.AMPDeviceDiscoveryAgent, com.apple.AMPDevicesAgent, com.apple.amp.mediasharingd
AMP	Asynchronous Multiprocessing; performance and power-efficiency cores on Apple Silicon
AMS	Apple Media Services; formerly the iTunes stores and media services: App Stores, Apple Music, Apple TV, iCloud media library, Apple Podcasts, Podcast sync, Books Store, Books sync; AppleMediaServices.framework; server: phobos.apple.com
AMX	Apple Matrix Extension; ARM instruction set extension for matrix operations
ANE	Apple Neural Engine, hardware accelerator for neural network operations; ANECompiler.framework, ANEServices.framework; launchd service: com.apple.aned
Anisette	two-factor authentication creates security codes on trusted devices using TOTP, probably using Circle keys, checked by HSA; AuthKit.framework; launchd service: com.apple.akd
AOP	Always On Processor, part of Apple SoCs, runs RTKit as operating system
AOS	Apple Online Services? historical name for iCloud
Apache	built-in web server; command line tool: apachectl
APFS	Apple File System; copy-on-write file system with support for volume space-sharing, per-file encryption, and snapshots
APNS	Apple Push Notification service, server infrastructure for remote push notifications over a single connection, clients subscribe to push topics, can be authenticated by app (remote notifications), device (Find My …), or Apple Account login (DSID); credentials in apsd keychain; launchd service: com.apple.apsd; server: push.apple.com
App Nap	quiescence detection for applications and corresponding self-demotion in scheduler parameters, implemented within application frameworks and RunningBoard, listens for occlusion notifications from WindowServer
App Sandbox	Seatbelt-based sandbox for apps; /System/Library/Sandbox/Profiles/application.sb; enabled with com.apple.security.app-sandbox entitlement; launchd service: com.apple.secinitd
AppleCare	extended warranty; NewDeviceOutreach.framework; launchd service: com.apple.ndoagent
APT	Adaptive Picture Timing? ProMotion; dynamic screen updates with 120Hz base frequency; AppleDisplayTCONControl.framework
Ask To	parental-controlled user can ask parent for exceptions; launchd service: com.apple.asktod; AskToCore.framework
ASL	Apple System Logger, superseded by Unified Logging; /etc/asl; stored in /var/log/asl; launchd service: com.apple.syslogd; command line tool: syslog
ASR	Apple Software Restore; restore entire volumes from sources like disk images (HDI, SIU), also restores based on APFS snapshots and snapshot deltas; command line tool: asr
Assertions	power state management allowing applications to prevent sleeping; launchd service: com.apple.powerd; command line tools: caffeinate, pmset
Assessment	checking of System Policy; term also used for AAC
Asset Cache	discretionary caching server for Mobile Assets, Packages, iOS updates, App Store content, ODR, MMCS data; launchd services: com.apple.AssetCache.builtin, com.apple.AssetCacheLocatorService, com.apple.AssetCacheManagerService, com.apple.AssetCacheTetheratorService; command line tools: AssetCacheLocatorUtil, AssetCacheManagerUtil, AssetCacheTetheratorUtil
Assistant	Siri; speech recognition and semantic understanding, dialog management by CDM, Intent is communicated to and enacted on the client, uses TTS for speech output, Snippets to embed mini UIs into responses; /System/Library/Assistant, /System/Library/Snippets, AssistantServices.framework; server: *.siri.apple.com
ATS	App Transport Security, sandbox mechanism only allowing TLS-secured connections
ATSUI	Apple Type Services for Unicode Imaging; rendering engine superseded by CoreText.framework, font management; ApplicationServices.framework/ATS.framework; launchd service: com.apple.xtyped (fontd); command line tools: atsutil
ATT	App Tracking Transparency; apps declare user tracking on app store
Attestation	cryptographic proof of a genuine SEP; used for web authentication and app attestation; DeviceCheck.framework; SEP responds to challenge using hardware-key (GID, PKA), online service verifies; used to pair Touch ID keyboards, used to pair RemoteXPC channel?
Authorization	discretionary access control policies for high-level services; similar to PAM; policy stored in /var/db/auth.db
Avatar	Memoji and Animoji, including pre-rendered iMessage stickers; AvatarKit.framework
AVB	Audio Video Bridging, low-latency audio over Ethernet; launchd service: com.apple.avbdeviced; command line tools: avbanalyse, avbdiagnose, avbutil
AWD	Apple Wireless Diagnostics, sends system telemetry to Apple; CoreAnalytics.framework, WirelessDiagnostics.framework; launchd services: com.apple.analyticsd
AWDL	Apple Wireless Direct Link; secondary WiFi interface that runs in parallel to an active WiFi access point connection, similar to WiFi Direct (p2p interface), uses a randomized MAC, used for peer-to-peer networking: AirDrop, AirPlay; DeviceToDeviceManager.framework
Background Assets	assets that an app extension loads without the app being launched; BackgroundAssets.framework; launchd service: com.apple.backgroundassets.user
Bezel	on-screen overlays for hardware volume buttons, screen brightness, Bluetooth HID, and others; /Library/Application Support/Apple/BezelServices, launchd services: com.apple.loginwindow, com.apple.OSDUIHelper
Bifrost	emergency satellite connectivity; /System/Library/LocationBundles/Bifrost.bundle
Biome	CloudKit-synced streaming and storage of events like donated and invoked Intents; semantic index to ground AI with personal context; BiomeStreams.framework, BiomeSync.framework; launchd services: com.apple.BiomeAgent, com.apple.biomesyncd; embedding vector extraction and storage: ZeoliteFramework.framework
Blast Door	sandboxed sanitization process for untrusted input, used for iMessage, IDS, Telephony, media analysis; BlastDoor.framework, CTBlastDoorSupport.framework, IDSBlastDoorSupport.framework, MediaAnalysisBlastDoorSupport.framework, MessagesBlastDoorSupport.framework, TelephonyBlastDoorSupport.framework
BOM	Bill of Materials; format to store contents of installer Packages; command line tool: lsbom
Bonjour	mDNS; launchd service: com.apple.mDNSResponder.reloaded; command line tool: dns-sd
Boot Cache	disk cache pre-heating at boot time with typically loaded applications; /var/db/BootCaches; launchd service: com.apple.warmd
Boot Policy	decides by signature check which OSes can be booted, boot-time equivalent for System Policy; LocalPolicy stores user settings, configurable from 1TR, stored by SEP, enforced by iBoot; command line tools: bputil, kmutil (to enroll custom kernels)
BPR	Boot Progress Register; set-only flags to track boot mode (normal, DFU, recovery), part of Keybag class key derivation within SEP, so passcode-protected keys are inaccessible in DFU and recovery
Bridge	T2 ARM CPU in Intel Macs to drive Touch Bar and Boot Policy; runs bridgeOS, a derivative of watchOS; boots the platform and the Intel CPU, communication from macOS uses RemoteXPC; launchd service: com.apple.multiversed; /System/Library/MultiversePlugins
Brook	hand washing encouragement on watch; BrookServices.framework
Bulletin Board	application push notification management, aggregates local and remote push notifications; BulletinBoard.framework
Cache Delete	cleanup for various caches; /System/Library/CacheDelete; launchd service: com.apple.cache_delete (deleted)
CAML	Core Animation Markup Language; XML file format for layers, shapes and animations
Carousel	derivative of SpringBoard for Watch home screen, watch face, and notification center
CBOR	Concise Binary Object Representation; JSON-inspired compact binary data serialization; CBORLibrary.framework
CDHash	Code Directory Hash; a hash of hashes over the parts of a code bundle; command line tool: codesign
CDM	Continuous Dialog Manager; natural dialog with Siri, MARRS for multi-modality; ContinuousDialogManagerService.framework
CEC	Consumer Electronics Control; remote control for HDMI-connected devices; CoreRC.framework, IOCEC.framework
Celestial	media streaming used by ReplayKit for in-app screen broadcasts; Celestial.framework; launchd service: com.apple.replayd
Certificates	validity checked using CRLs, OCSP stapling, and transparency logs; /System/Library/Security/Certificates.bundle; launchd services: com.apple.trustd, com.apple.trustd.agent, com.apple.ocspd; command line tool: crlrefresh
Chamois	Stage Manager
CHIP	Connected Home over IP; Matter; integrated into HomeKit, can use Thread as transport layer; HomeKitMatter.framework, CoreThread.framework; launchd services: com.apple.threadradiod, com.apple.ThreadCommissionerService
Circle	cryptographic primitive to exchange public keys of trusted devices of a user, signed by Circle peers; iCloud identity added as additional Circle peer, private key synced across all trusted devices, new devices can pull this key from Secure Backup to join the Circle; per-device Circles stored in CKKS for two-factor accounts (Octagon); KeychainCircle.framework; command line tools: otctl (Octagon)
CKKS	CloudKit Key Sync, end-to-end secure syncing for credentials, seeded by Circle; currently includes ApplePay, AutoUnlock, CreditCards, DevicePairing, Engram, Health, Home, Manatee, SOS, WiFi and other keys; launchd service: com.apple.secd; command line tool: ckksctl
CL4	Apple’s variant of the L4 microkernel, derived from Pistachio and Wombat/Darbat
Clarity	customizable accessibility mode for simplified UI; ClarityFoundation.framework
Classroom	school teachers can create assignments for student iPads and track progress in Schoolwork app; ClassKit.framework; launchd service: com.apple.studentd
Cloud Pairing	part of Alloy, Bluetooth out-of-band pairing over iCloud for Continuity; launchd service: com.apple.BTServer.cloudpairing (cloudpaird)
CMAS	Commerial Mobile Alert System, now known as Wireless Emergency Alerts (WEA)
Commpage	user-mapped kernel data, like vdso/vsyscall on Linux; mapped at 0x7fffffe00000
Communications Filter	recipient blocking for iMessage, FaceTime, Mail; launchd service: com.apple.cmfsyncagent
Companion	iPhone that is linked with Watch, Mac, or Apple TV; communication with Watch uses Alloy over IPsec over Bluetooth, AWDL on demand; launchd service: com.apple.companiond; Bonjour service: _companion-link._tcp
Contact Key Verification	code for manual verification of iMessage keys; code identifies a long-lived account key stored in iCloud Keychain, which signs all ESS device keys
Continuity	umbrella term for Handoff, Sidecar, iPhone Mirroring, SMS relay, Universal Clipboard, Watch unlock, WiFi call relay and others; SMS relay works by proxying to iMessage, other services use Alloy for signalling and AWDL for payload; /System/Applications/iPhone Mirroring.app, ScreenContinuityServices.framework
Control Center	icons in menu/status bar and Bento Box controls UI, gradually replaces SystemUIServer on macOS; handles incoming AirPlay content; launchd services: com.apple.controlcenter, com.apple.SystemUIServer.agent
CPML	CorePrediction Machine Learning; CPMLBestShim.framework
CRD	Conference Room Display; Apple TV mode
Cryptex	Cryptographically sealed Extension of SSV, mount-invisible extension of the root volume, allows lightweight updates as part of Rapid Security Response; /System/Cryptexes (mountpoint), /System/Volumes/Preboot/*/cryptex1/current/*.dmg (disk images)
CSR	Configurable Security Restrictions; XNU subsystem that is the basis for SIP
CTK	Crypto Token Kit; smart card management, also for the Secure Element on iOS? launchd service: com.apple.ctkd; command line tool: sc_auth
CTS	Centralized Task Scheduling; execution of DAS tasks; /System/Library/UserEventPlugins/com.apple.cts.plugin
CVMS	Core VM Server/Service? compilation of GPU shaders; launchd service: com.apple.cvmsServ
DAAP	Digital Audio Access Protocol; used by Home Sharing (with Rapport token) and by the Remote app to control Apple TV (with pairing token); payload unencrypted; DAAPKit.framework; Bonjour services: _atc._tcp, _home-sharing._tcp, _mediaremotetv._tcp, _touch-able._tcp
Daily Briefing	Siri giving an overview of information for the day; SiriDailyBriefingInternal.framework
DART	DMA Address Relocation Table; IOMMU implementation in Apple silicon, positioned in front of every DMA-capable co-processor and peripheral, offers sub-page protection; SART: streaming variant for high-throughput devices (like NVMe)
Darwin Directory	static store for users and groups, saves Open Directory interaction for the local case? /usr/lib/system/libsystem_darwindirectory.dylib, /System/Library/DarwinDirectory, /private/var/db/DarwinDirectory; command line tool: dddiagnose
DAS	Duet Activity Scheduler; scheduling policy engine behind NSBackgroundActivityScheduler and XPC activities; /System/Library/DuetActivityScheduler; launchd service: com.apple.dasd
Data Detectors	text analysis to highlight phone numbers, street addresses, and the like; DataDetectors.framework
Data Vault	directories with the UF_DATAVAULT special flag; CSR limits access to one application
DAV	Distributed Authoring and Versioning; network protocol on top of HTTP for syncing calendars (CalDAV), contacts (CardDAV), and formerly also bookmarks (BookmarkDAV)
DCP	Display Co-Processor
DDE	Device Discovery Extension; detects devices on local network without app access to local network; DeviceDiscoveryExtension.framework, DeviceDiscoveryUICore.framework; extension point: com.apple.discovery-extension
DEP	Device Enrollment Program; devices check in with Apple during Setup Assistant to query for their enrollment status, retrieve MDM server URL to fetch initial configuration profile
Developer Mode	enables launching of self-compiled apps in iOS, rough equivalent to System Policy; command line tool: devmodectl
DFR	Dynamic Function Row?, TouchBar; /System/Library/CoreServices/ControlStrip.app; DFRFoundation.framework
DFU	Device Firmware Update; special boot mode where iOS has not booted and the system can be installed over the Lightning connection
Differential Privacy	crowdsourcing without user tracking; privacy budget for management of anonymity set; used for keyboard words, emoji, Spotlight searches, Parsec deep links, HealthKit usage, Safari telemetry; /System/Library/DifferentialPrivacy; stored in /var/db/DifferentialPrivacy; launchd service: com.apple.dprivacyd
Digital Separation	safety check feature to inhibit sharing relationships; DigitalSeparation.framework
DMC	Device Management Client; part of MDM; DMCUtilities.framework
DMC	Disk Mount Conditioner; simulates slow IO devices; command line tool: dmc
DND	Do Not Disturb
Dose	ambient sound level checking on Watch; /Applications/Dose.app
DSID	Destination Signaling Identifier, unique ID for IDS login on a specific device
DTrace	system-wide tracing infrastructure, command line tools: dtrace, *.d, dappprof, dapptrace, dtruss, errinfo, execsnoop, fddist, fs_usage, imptrace, iopattern, iopending, iosnoop, iotop, lastwords, latency, opensnoop, plockstat, rwsnoop, sampleproc, sc_usage, topsyscall, topsysproc
Duet	telemetry collection engine for system and user events, forecasting by machine learning, backend for DAS, Proactive, Relevance, Screen Time, thermal and battery management; /System/Library/DuetKnowledgeBase, /System/Library/DuetExpertCenter; CoreDuet.framework, CoreKnowledge.framework, CorePrediction.framework, CascadeEngine.framework (link to Biome); launchd services: com.apple.coreduetd, com.apple.duetexpertd, com.apple.knowledge-agent, com.apple.ospredictiond
Dyld Shared Cache	dynamic linker cache, stores all system libraries in prelinked form, original library files are removed; /System/Volumes/Preboot/Cryptexes/OS/System/Library/dyld; command line tools: dyld_info, dyld_usage, update_dyld_shared_cache
EAS	Exchange Active Sync; network protocol for accessing Microsoft Exchange servers
EDR	Extended Dynamic Range; rendering with transfer function extending beyond sRGB white; implemented natively on XDR displays and by backlight modulation on others; HDRProcessing.framework
Energy Impact	unitless metric for per-application energy consumption, machine-specific coefficients; /usr/share/pmenergy, launchd services: com.apple.sysmond, com.apple.thermald; command line tool: powermetrics
Engram	Messages in iCloud; devices store received iMessages in CloudKit; Engram.framework
Entitlements	capability-like attributes bound to executables by code signing; some entitlements like App Sandbox restrict ambient authority, some gradually relieve those restrictions (using Seatbelt), some services or system calls grant privilege based on caller entitlements
ESS	IDS user directory, public key distribution for iMessage and CloudKit sharing, uses Transparency; server: *.ess.apple.com; launchd service: com.apple.identityservicesd
Exclave	user-level portions of kernel or SEP services, used for paravirtualized access by VMs; /usr/libexec/init_exclavekit
Eye Relief	screen distance warning for handheld devices; /Applications/EyeReliefUI.app
FaceTime	video calls, employs the ICE (establishing peer-to-peer connection), STUN (session credential exchange) and SRTP (encrypted media streaming) protocols; FTServices.framework; launchd services: com.apple.videoconference.camera (avconferenced)
FairPlay	DRM system used by app and media stores; CoreADI.framework, CoreFP.framework, CoreLSKD.framework; launchd services: com.apple.adid, com.apple.fairplayd (invoked by kernel through host special port 17), com.apple.lskdd; credentials stored in /var/db/fpsd
Family Circle	Family Sharing; launchd services: com.apple.familycircled, com.apple.askpermissiond
FDE	Full Disk Encryption, FileVault; command line tool: fdesetup, sysadminctl
FDR	Factory Data/Device Reset? ensures that no downgrades are performed? servers: skl.apple.com, gg.apple.com; /System/Library/FDR
Feldspar	Apple News; Silex.framework
FiDES	Fi? Distributed Evaluation Service? aggregates Differential Privacy data for unlinkability? used for emoji, Suggestions, Dictation; /System/Library/DistributedEvaluation; DistributedEvaluation.framework, FedStats.framework (private federated learning?)
File Provider	infrastructure and extension system for syncing with cloud providers; placeholder files based on SF_DATALESS attribute in APFS; FileProvider.framework; locally stored in ~/Library/CloudStorage; command line tool: fileproviderctl
Find My	location sharing by explicitly querying devices remotely or collateral beacon detection using Search Party; FMCore.framework, FMF.framework
Firmlink	bi-directional non-symbolic link between the read-only system volume and the data volume, additional symlinks and mountpoints in the root directory are virtually allocated; /usr/share/firmlinks, /etc/synthetic.conf
Focus	restriction modes for notification presentation; focus filters for in-app display restrictions, communicated by Intents; Focus.framework, DoNotDisturb.framework; local settings in ~/Library/DoNotDisturb
FollowUp	user interaction for Secure Backup wrapping with device passcode, CoreFollowUp.framework; launchd service: com.apple.followupd
FoundationDB	fundamental iCloud storage database, marketed as CloudKit, separated into containers; records, blobs, and large asset storage with MMCS, server-side continuous queries can trigger push notifications, user management by IDS, sharing between users by GroupKit; PCS keys used for hierarchical zone, record, and asset encryption; CloudKitDaemon.framework; launchd service: com.apple.cloudd; locally stored in ~/Library/Caches/CloudKit, ~/Library/Containers/*/Data/CloudKit; command line tool: cktool
FPR	Fast Permission Restrictions; Apple CPU registers to downgrade (old APRRs do bitmasking) or remap (SPRRs since M1) actual permissions of memory pages (the CTRR region) per thread
FSKit	user space file system support; kernel stub file system is /System/Library/Extensions/lifs.kext; file systems are in /System/Library/ExtensionKit/Extensions/com.apple.fskit.*; launchd service: com.apple.filesystems.fskitd, com.apple.filesystems.doubleagentd (handling of Apple double files in user space); extension point: com.apple.fskit.fsmodule
FUD	Firmware Update Daemon; see TSS, UARP; launchd service: com.apple.accessoryupdaterd
Game Mode	auto-activates when games are shown full screen, throttles background work, lowers audio and input latency; launchd service: com.apple.gamepolicyd
GID	group ID key, shared across all devices of the same SoC generation, derived keys are used to prove device type over the network, only accessible by SEP
Gizmo	Apple Watch; watch settings managed by Companion iPhone; /Applications/Bridge.app, /System/Library/BridgeManifests
Greymatter	Apple Intelligence; on-device language and diffusion models, larger server-based models in PCC; AFM refined for specific tasks (queries, summarization, categorization) by adapters (parameter for inserted network modules); grounded with context from Biome and intelligence stores; ~/Library/IntelligencePlatform; launchd service: com.apple.modelmanagerd (model residency management); /System/Library/ModelManager/Policy.plist; /Applications/Tamale.app (Camera Control integration); command line tool: csfdiagnose (cloud subscription features), modelmanagerdump
Group Activities	SharePlay; sharing of media content and programmatic state over FaceTime calls; GroupActivities.framework, CopresenceCore.framework; launchd service: com.apple.telephonyutilities.callservicesd
GroupKit	groups of IDS users with shared CloudKit (PCS) access; GroupKitCrypto.framework
GSS	Generic Security Service; part of Kerberos; GSS.framework; launchd service: com.apple.gssd (invoked by kernel through host special port 19); command line tool: gsstool
GXF	Guarded Execution Feature/Fault, additional exception levels on Apple Silicon, lateral to the usual exception levels; page tables remain the same, but interpretation of permission bits changes by way of FPR, genter and gexit instructions; implements lightweight intra-address-space protection contexts
HAP	Home Automation Protocol; CoreHAP.framework
HDI	Hard Disk Image; command line tool: hdiutil
HeadBoard	derivative of SpringBoard for tvOS home screen; /Applications/HeadBoard.app, /Applications/PineBoard.app
Health Balance	vitals app on Watch; /Applications/NanoHealthBalance.app
HLS	HTTP Live Streaming
HomeEnergy	HomeKit management for grid energy supply; EnergyKit.framework
HSA	Hardware Security Architecture; version 1 used for two-step verification, SOS with iCSC; version 2 for two-factor authentication, CKKS and Secure Backup with iCDP
HSM	Hardware Security Module; HSM fleet runs escrow service for Secure Backup
Hyperion	iCloud Photos, uses CloudKit; launchd service: com.apple.cloudphotod
IAP	iPod Accessory Protocol; IAP.framework
