Term	Description
iBoot	boot loader stage after boot ROM or UEFI (macOS on Intel); intermediate Low-Level Bootloader (LLB); DFU mode is implemented here; /System/Library/CoreServices/boot.efi
iCDP	iCloud Data Protection, codename for a set of enhancements to iCloud privacy: device passcodes used as iCSC for Secure Backup, root keys for CKKS-enabled services only synced between devices and not stored at Apple; launchd service: com.apple.cdpd
iCloud	umbrella term for a conglomerate of services, consists of FoundationDB containers with PCS views for key management, supported by CKKS; uses IDS and APNS; some services under the iCloud name are actually served by AMS, IMAP, or DAV
iCSC	iCloud Security Code, credential wrapping for Secure Backup, previously used a separate code, with HSA2/iCDP uses device passcodes
IDAM	Inter-Device Audio and MIDI; audio connection between devices
IDS	Identity Directory Service, also IDMS, Apple Account identity management for all of Apple’s online services; APNS topics for signaling and messaging, see also Alloy, ESS, FaceTime, iMessage; authentication to services with Kerberos
IDV	Identity Verification? Touch ID and Face ID; /System/Library/AccessibilityBundles/CoreIDVUI.axbundle
IM	Instant Messaging; usually means iMessage and FaceTime
IMG4	boot files (Mach-O binaries or configuration data) with ASN.1 signature, contains RemotePolicy certificate constraints to restrict Boot Policy evaluation
Intent	semantic interaction between app and system (or another app); used for Siri, Shortcuts, Maps (contextual suggestion), Widgets (configuration); definition by file or programmatically using AppIntents.framework; command line tool: appintentsmetadataprocessor (Xcode extracts Intent definition at compile time); extension points: com.apple.intents-service, com.apple.intents-ui-service
IOKit	device driver subsystem for in-kernel and DriverKit drivers, command line tool: ioreg
Ironwood	dictation, customized on server with selected user data (contacts, app names, music titles, HomeKit names, Siri Shortcut phrases), not tied to Apple Account; SpeechRecognitionCore.framework, ASRBridge.framework; server: guzzoni.apple.com
ISP	Image Signal Processor; camera imaging circuit in iPhones
ITML	iTunes Markup Language; metdata tagging for media services; ITMLKit.framework
ITP	Intelligent Tracking Prevention, cross-site tracking defenses in Safari, statistics and user interaction classify sites, cookies are partitioned and access is restricted
JARVIS	Just A Rather Very Intelligent Scheduler, Mesos cluster manager for Siri, iCloud, AMS
Jellyfish	Animoji; /Applications/Jellyfish.app
Jetsam	reclaiming of purgeable memory and termination of apps during memory pressure
JSC	JavaScript Core; JavaScriptCore.framework; command line tool: jsc
Kalamata	codename for the transition from x86 to ARM-based Apple Silicon
Kerberos	single-sign-on mechanism; Heimdal.framework; command line tools: kinit, ktutil
Kext	kernel extension mechanism, loaded at boot time as part of a Kext Collection; /Library/Extensions, /Library/StagedExtensions (for user approval), /System/Library/Extensions; command line tool: kextutil (manages deprecated runtime loading)
Kext Collection	prelinked sets of kernel extensions; /System/Library/KernelCollections (for boot and system kexts), /Library/KernelCollections (for auxiliary third-party kexts); the latter is only loaded at a lower-security Boot Policy; launchd service: com.apple.kernelmanagerd (invoked by kernel through host special port 15); command line tool: kmutil
Keybag	storage of protection class keys for Keychain and filesystem, protected by SEP using SKP; stored in user.kb; launchd services: com.apple.mobile.keybagd, com.apple.secd
Keychain	storage for credentials; launchd service: com.apple.securityd; command line tools: certtool, security, systemkeychain
KIP	Kernel Integrity Protection, locking of physical memory pages to prevent changes to kernel
Launch Services	management for application launches, association of UTIs to apps, uses Spotlight to update cached info; launchd services: com.apple.coreservices.launchservicesd, com.apple.lsd; CoreServices.framework/LaunchServices.framework; command line tools: lsappinfo, lsregister
Live Files	user mode filesystems, currently FAT, ExFAT, NTFS on external storage; UserFS.framework, UVFSXPCService.framework; launchd service: com.apple.filesystems.userfsd
Liverpool	PCS codename for CloudKit
LKDC	Local Key Distribution Center, Kerberos on client machines
LSM	Latent Semantic Mapping, text analysis, used for spam filtering, command line tool: lsm
Mac Buddy	historic name for Setup Assistant
MAC Policy	Mandatory Access Control subsystem in XNU, based on TrustedBSD, implements policy hooks for restricted kernel operations; current policies: AMFI, Seatbelt, Quarantine, CSR
Machine Learning	Vision.framework, Espresso.framework, Futhark.framework, PhotoAnalysis.framework; used for Live Text and Visual Lookup; launchd service: com.apple.mediaanalysisd
Madrid	iMessage; /System/Library/Messages
Manatee	PCS key for some CloudKit containers are synced via CKKS, so data is unreadable to Apple (credential management codenames: Plesio, Stingray, Cuttlefish)
Mandrake	emergency siren on Apple Watch Ultra; /Applications/Mandrake.app
Mangrove	transfering UI tiles over XPC; Mangrove.framework, IOSurface.framework
Marco	Marco.framework, something about IDS and communication (iMessage, Calls), logging?
Marklar	codename from the PowerPC era for the port to x86, served the transition to Intel CPUs
MARRS	Multimodal Reference Resolution; Marrs.framework
Marzipan	Catalyst; port of iOS frameworks to macOS, Catalyst apps are iOS apps with additional API to adapt macOS UI idioms; /System/iOSSupport; integration using UIKit system process; launchd service: com.apple.uikitsystemapp; input remapping by /Library/Apple/Library/Bundles/InputAlternatives.bundle
MCX	Managed Client for OS X, preference management for settings from configuration profiles, /Library/Managed Preferences, command line tools: mcxquery, mcxrefresh
MDM	Mobile Device Management; server software to manage fleets of iOS and macOS devices; uses configuration profiles to manage preferences; ConfigurationProfiles.framework
MDS	Module Directory Services, ancient part of the old security APIs (CSDA, CSSM)
Memory Debugging	uses Taskport; command line tools: heap, leaks, malloc_history, stringdups, vmmap
Mesa	Touch ID; /Library/Catacomb
Metadata	Spotlight; file indexing on macOS; CoreServices.framework/Metadata.framework, CoreServices.framework/SearchKit.framework; stored in .Spotlight-V100; launchd service: com.apple.metadata.mds; command line tools: mddiagnose, mdfind, mdimport, mdls, mdutil; in addition to auto-indexing, apps can explicitly register searchable items; CoreSpotlight.framework; launchd service: com.apple.corespotlightd
Micro Location	positioning service on macOS (because there is no GPS?); MicroLocation.framework; launchd service: com.apple.milod
MLHost	background machine learning service; launchd service: com.apple.mlhostd; /System/Library/MLHost; DeepThought.framework, LighthouseBackground.framework, LighthouseBitacoraFramework.framework, Dendrite.framework
MMCS	MobileMe Chunk Storage, used by iCloud, splits blobs into chunks and stores them at Apple/AWS/GCP with convergent encryption (content hash as key); MMCS.framework
Mobile	prefix for iOS
Mobile Assets	demand-downloaded system components like fonts, dictionaries, linguistic data; stored in /System/Library/Assets; launchd services: com.apple.languageassetd (language-dependent assets), com.apple.mobileassetd; server: mesu.apple.com
Mobile Device	connectivity to iOS devices over USB or WiFi (AirTrafficHost) for syning, development, and debugging; MobileDevice.framework; launchd service: com.apple.usbmuxd; Bonjour service: _apple-mobdev2._tcp
MOC	Managed Object Context; Core Data object space
Mondrian	photo collage arrangement in Photos.app; Mondrian.framework
MRT	Malware Removal Tool; /Library/Apple/System/Library/CoreServices/MRT.app; superseded by XProtect
Multipeer Connectivity	ad-hoc networking; Bonjour for discovery; WiFi, AWDL, Bluetooth, or Ethernet as transport; optional encryption and certificate-based authentication; MultipeerConnectivity.framework
Nano	prefix for watchOS
Nearby Interaction	proximity-based interaction between devices; proximity measured using ultra wideband or derived from other technologies; used for Universal Control, tapping phones for AirDrop; NearbyInteraction.framework, Proximity.framework; launchd services: com.apple.aonsensed (always-on sense daemon), com.apple.nearbyd
Nebula	sleep apnea detection on watchOS; BreathingAlgorithms.framework
New Device Outreach	high-level Bluetooth device pairing flow; NewDeviceOutreach.framework, NDOAPI.framework, NDOUI.framework; launchd service: com.apple.ndoagent
Newton	fall detection on watchOS
NLP	Natural Language Processing; NLP.framework; related to mecabra libraries, a linguistic engine for Chinese and Japanese; /usr/share/mecabra, /usr/share/tokenizer
Notarization	app security scan by Apple; cryptographic proof stapled to code signature, tested at launch by System Policy; for non-notarized apps sends code hash to Apple; command line tools: notarytool, altool, stapler
Noticeboard	User Notifications for Software Update and App Store, Noticeboard.framework; launchd services: com.apple.noticeboard.state (nbstated), com.apple.noticeboard.agent (nbagent)
Notifications	system notification bus, unrelated to the local/remote push notifications; launchd service: com.apple.notifyd, com.apple.kuncd (invoked by kernel through host special port 10); command line tool: notifyutil; complemented by framework-level notification system (CFNotification, NSNotification); launchd services: com.apple.distnoted.xpc.daemon, com.apple.distnoted.xpc.agent
NSP	Network Service Proxy; per-app VPN and proxy settings, implements Private Relay; launchd service: com.apple.networkserviceproxy
OAH	Rosetta; ahead-of-time compiler for Intel code on Apple Silicon, usable from Linux VMs by way of a custom binformat; /usr/libexec/rosetta, /var/db/oah (AOT cache); launchd service: com.apple.oahd
ODR	On-Demand Resources; loaded from App Store; launchd service: com.apple.appstored
Omni Search	fuzzy semantic search with results recognized in images; OmniSearch.framework
Onboarding	data protection splash screen shown by service-connected apps; /System/Library/OnBoardingBundles; OnBoardingKit.framework
Open Directory	directory service for user, group, and machine management; plugin-based to use different backend stores (LDAP, Active Directory), local accounts in /private/var/db/dslocal, populated from /System/Library/DirectoryServices/DefaultLocalDB; launchd service: com.apple.opendirectoryd; command line tools: dscacheutil, dscl, dsconfigad, dsconfigldap, dseditgroup, dsenableroot, dserr, dsexport, dsimport, dsmemberutil, odutil
OpenBSM	Open Basic Security Module; deprecated security audit subsystem; /etc/security, /var/audit; launchd service: com.apple.auditd; command line tool: audit
Opus	create slide shows from photos; Slideshows.framework
OSA	Open Scripting Architecture; scripting of applications from different fontend languages (currently AppleScript and JavaScript); backed by Apple Events; command line tools: osacompile, osadecompile, osalang, osascript, sdef, sdp
OTUT	One-Time Unlock Token; security mechanism to allow keybag unwrapping after updates
PAC	Pointer Authentication Codes; pointers signed in unused bits to prevent ROP attacks
Packages	unit of software installation; command line tools: pkgutil, installer, softwareupdate; launchd services: com.apple.softwareupdated, com.apple.bootinstalld, com.apple.installd, com.apple.system_installd, com.apple.uninstalld; /var/db/softwareupdate, /Library/Apple/System/Library/Receipts (system), /System/Library/Receipts (read-only), /private/var/db/receipts (App Store)
Packet Filter	network traffic filtering subsystem from OpenBSD; command line tool: pfctl
Parsec	Spotlight web results and searching of crowdsourced Intent deep links; server: *.smoot.apple.com; launchd services: com.apple.parsecd, com.apple.parsec-fbf (Feedback Flush to Differential Privacy); telemetry collection with Poirot: PoirotSQLite.framework, PoirotUDFs.framework, SearchOnDeviceAnalytics.framework
Party Studio	Karaoke mode on tvOS, where video from a paired phone is shown with effects; /System/Library/PrivateFrameworks/PartyStudio.*
Passkey	keypair used for authentication instead of password, synced via SOS, implements WebAuthn standard; keys can be used to login on separate device via QR code and Bluetooth proximity proof; AuthenticationServices.framework
Password Breach	monitoring of Keychain passwords against a breach database; round-robin matching in fixed-size batches, local match against common leaks, remote match using hash prefix; launchd service: com.apple.Safari.passwordbreachd
Pasteboard	storage for cut, copy, and paste; type of content remembered as UTI; launchd service: com.apple.pboard; command line tools: pbcopy, pbpaste
PAT	Private Access Tokens; blind challenge-response authentication; Apple server attests user validity to token issuer, issuer performs blind signature, websites receiving the token cannot identify user; used for Private Relay, can replace CAPTCHAs
PCC	Private Cloud Compute; server-based AFM for AI, running on Apple Silicon managed by SEP; stateless computation, PAT to authorize user, Attestation of remote code by device, measurements published in Transparency; ~/Library/PrivateCloudCompute; launchd services: com.apple.privatecloudcomputed, com.apple.swtransparencyd
PCS	Protected Cloud Storage; key management for separate iCloud storage compartments (PCS calls them views), each can contain FoundationDB plus bulk data stored by MMCS; see also iCDP, CKKS, GroupKit, Manatee; ProtectedCloudStorage.framework; /System/Library/Preferences/ProtectedCloudStorage; command line tool: pcsstatus
PCSC	Personal Computer Smart Card; PCSC.framework, uses CTK
PDE	Print Dialog Extension; old name, not a proper Extension
PEC/PIR	Private Encrypted Compute and Private Information Retrieval; used for parental controls for media and web; CipherML.framework; launchd service: com.apple.ciphermld
Pegasus	meaning 1: picture-in-picture video playback; Pegasus.framework (iOS), PIP.framework (macOS); meaning 2: online search query engine for visual lookup; PegasusKit.framework
People	contacts with Apple Accounts within Group Activities and Shared With You
Pepper	UI elements for Watch home screen and Chat, like Quickboard (canned replies), Animoji; PepperUICore.framework
Persona	separation of sub-user-identities, like when using a private and managed Apple account; PersonaKit.framework; ~/Library/Personas; /System/Library/UserManagement; command line tool: umtool
PHASE	Physical Audio Spatialization Engine; 3D sound rendering engine; Apple devices map audio sources (even mono and stereo) to virtual speakers in a 3D sound stage, which is simulated by the physical speakers via a head-related transfer function; PHASE.framework
Piano Mover	Mail Drop; bulk mail attachments transfered over PCS; not to be confused with storage for iMessage attachments, which uses a CloudKit container
Plugin	Extensions, XPC services bundled with apps or frameworks, discovery by Launch Services; extension points listed in /System/Library/ExtensionKit/ExtensionPoints; launchd service: com.apple.pluginkit.pkd; command line tool: pluginkit
PMC	Performance Monitoring Counters; Recount.framework; /usr/share/kpep
PMP	Port Mapping Protocol; Apple alternative to UPnP, Bonjour service: _acp-sync._tcp
Poster	iPhone lock screen; PosterBoard.framework, PosterKit.framework; /Library/Wallpaper
PowerUI	battery management like smart charge and power save, learns from Duet and other data; PowerUI.framework; /var/db/PowerUI; launchd service: com.apple.PowerUIAgent
Preferences	storage for user-configurable settings; launchd services: com.apple.cfprefsd.xpc.daemon, com.apple.cfprefsd.xpc.agent; stored in Library/Preferences, command line tool: defaults; interaction with Synced Defaults per /System/Library/DefaultsConfigurations
Preview Shell	skeleton for on-device UI previews during development; /System/Library/CoreServices/PreviewShell.app; PreviewShellKit.framework, XOJIT.framework (code live patching)
Private Relay	two-hop onion routing with one entry and one exit node; Apple operates entry, third-party services operate exit nodes; QUIC for payload, ODoH for DNS, approximate IP geolocation via Waldo, authentication via PAT
Proactive	umbrella term for suggestions, completions, and summarizations based on Duet forecasting, Biome, and Intent context; PersonalizationPortrait.framework, ProactiveMagicalMoments.framework, ProactiveSummarization.framework
Provenance	per-file origin tracking, extended attribute com.apple.provenance stores ID into /var/db/SystemPolicyConfiguration/ExecPolicy
QoS Classes	inheritable property for Activities; semantic priorities, influences scheduling parameters; initially set at user-level, priority inheritance within GCD queues and across XPC in kernel?
Quagga	framework for QR and barcode decoding; Quagga.framework
Quick Action	extension type for quick interaction with foreign content within a host app; extension points: com.apple.services, com.apple.ui-services
Quick Look	file preview and thumbnail generation; comand line tool: qlmanage
RAOP	Remote Audio Output Protocol, AirPlay; Bonjour service: _raop._tcp
Rapport	device pairing by proximity using Alloy, with PIN entry, or using iCloud; once paired, devices can access services; used for HomeKit, HomePod, AirPlay, Home Sharing, SideCar; Rapport.framework, ProximityAppleIDSetup.framework; launchd service: com.apple.rapportd
RCS	Rich Communication Services; messaging service in mobile networks, successor to SMS; IMRCSTransfer.framework; /System/Library/Messages/PlugIns/RCS.imservice
Recents	recently used items (not files) in various applications, synced with Synced Defaults; CoreRecents.framework, /System/Library/Recents; launchd service: com.apple.recentsd
Relevance Engine	backend for Siri suggestions (for example of Siri Shortcuts), Widget smart stacks (also Siri watch face); consumes Duet knowledge and app-provided timelines with relevance hints; /System/Library/RelevanceEngine
Remote Pairing	Mobile Device pairing without wired connection; RemotePairingDevice.framework; Bonjour services: _remotepairing._tcp, _remotepairing-manual-pairing._tcp
RemoteXPC	connection to a non-SoC-integrated SEP like Bridge; uses HTTP/2 over a network interface, Bridge connected over USB, secured using Attestation; RemoteServiceDiscovery.framework, TrustedAccessory.framework; launchd service: com.apple.remoted, com.apple.tracd; command line tool: remotectl
Replicator	notification sync from Companion iPhone, also drives remotely displayed live activities; ReplicatorServices.framework; launchd service: com.apple.replicatord
Revisions	document autosave and auto-versioning; stored in .DocumentRevisions-V100; GenerationalStorage.framework; launchd service: com.apple.revisiond
Routine	frequently visited locations on iOS, interacts with Duet; launchd service: com.apple.routined
RTC	Real-time Telemetry and Crash reporting; RTCReporting.framework; launchd service: com.apple.rtcreportingd
RTKit	real-time runtime used for firmware of Apple Silicon co-processors; on top of CL4 in Apple’s cellular modem
RunningBoard	runtime management of apps, paradigm: app as service process invoked by system, check-in by frameworks, handles process assertions (frontmost app, see App Nap), memory pressure (see Jetsam) and compute resources (GPU), replacement for TAL?; launchd service: com.apple.runningboardd; /System/Library/LifecyclePolicy, /System/Library/RunningBoard
Safety Monitor	Check In; short-term location sharing in iMessage until a destination is reached; /Applications/SafetyMonitorApp.app
SBPL	Sandbox Profile Language; a TinyScheme-based embedded DSL for Seatbelt profiles
SCIP	System Coprocessor Integrity Protection; like KIP, but for SEP, ISP, Motion coprocessor
Screen Reader	VoiceOver and Braille; /System/Library/ScreenReader; ScreenReader.framework
Screen Time	digital wellbeing and parental controls system, uses Device Management as policy engine, self-enforced within the application by frameworks; DeviceActivity.framework, ManagedSettings.framework, FamilyControls.framework; launchd services: com.apple.ScreenTimeAgent, com.apple.dmd
SDB	SQL Database; CoreSDB.framework, used by iCloud communication
Search Party	portion of Find My service for offline devices; devices emit public part of rotating key pair via Bluetooth LE, other devices encrypt current location with this key and send to Apple, private key shared over CloudKit
Seatbelt	process sandbox by filtering system calls; profiles written in SBPL; /System/Library/Sandbox/Profiles, /usr/share/sandbox; default file access policy asks for TCC confirmation before access to folders with user data (like Documents) is allowed; command line tool: sandbox-exec; launchd service: com.apple.sandboxd (invoked by kernel through host special port 14 for logging)
Secure Backup	escrow part of CKKS; escrow key individually wrapped with passcodes of trusted devices, stored in HSM to prevent brute forcing, uses SRP so passcodes are not visible to iCloud, limited number of recovery attempts; protocol called Lakitu, uses FollowUp; launchd service: com.apple.SecureBackupDaemon (com.apple.sbd); CloudServices.framework
SEP	Secure Enclave Processor; dedicated ARM core for security services, runs CL4-based sepOS, inline encryption to DRAM, manages AES keys in storage DMA engine, factory-paired channels to Touch ID/Face ID hardware, Secure Element, Neural Engine; SEP can use but not read UID and GID keys; credential verification performed by hardware lockbox with retry count enforcement
Sequoia	translation; downloadable language models can run on-device; /Applications/SequoiaTranslator.app, Translation.framework
Seymour	Apple Fitness+; workout videos integrated with Watch sensors; SeymourCore.framework, Blackbeard.framework (personalisation and workout programs)
SF Symbols	scalable UI symbols; rendered with various color treatments; SFSymbols.framework
Shared File List	lists of recently opened files from apps that are stored with Launch Services; command line tool: sfltool; also manages login items and app-installed background daemons
Shared With You	collaboration features between apps and iMessage; content shared via iMessage is surfaced in apps (Swift Transferable protocol), content in apps can be collaboratively edited and connected to an iMessage group; collaborations are expressed by keys derived from participant device keys, padded with a number of random keys to prevent tracking of device count, a merkle tree of those keys is used to prove inclusion of a specific device to an app; SharedWithYou.framework
Sharing	umbrella term for wireless proximity services: AirDrop, Continuity, Instant Hotspot, WiFi sharing; used by loginwindow for Watch unlock; Sharing.framework; launchd service: com.apple.sharingd; also serves connection sharing and remote disk
Shazam	audio (especially music) recognition service; ShazamKit.framework; launchd service: com.apple.shazamd; command line tool: shazam
Shoebox	Passbook
Sidecar	using iPhone/iPad as Mac accessory: external camera and microphone (ContinuityCapture), camera for photos and scanning (DocumentCamera.framework), iPad as display over low-latency WiFi (llw interface) using avconferenced encoding; /Applications/Sidecar.app; SidecarCore.framework; launchd services: com.apple.sidecar-display-agent (SidecarDisplayAgent), com.apple.sidecar-relay (SidecarRelay)
Signpost	telemetry API to report points of interest in code; launchd service: com.apple.signpost.signpost_reporter
SIL	Secure Indicator Light; microphone and camera indicator on iPads rendered in hardware
Simulator	running an iOS/tvOS/watchOS personality on macOS, uses sandboxing and a separate Mach bootstrap namespace for container-like isolation; installable simulators as disk images in /Library/Developer/CoreSimulator/Images; command line tool: simctl
SIP	System Integrity Protection or rootless mode; collection of kernel-level security restrictions regarding file system modification, unsigned Kexts, Taskport access, NVRAM access, DTrace; /System/Library/Sandbox/rootless.conf; command line tool: csrutil, rootless-init
Site Association	signed files in .well-known directory on websites; equivalent to Entitlements for websites, associates domains with app IDs for Universal Links; command line tool: swcutil
SKP	Sealed Key Protection; measurement of system state (boot chain IMG4 manifests, BPR, Boot Policy data, UID key, user passcode) to derive Keybag keys
SKS	Secure Key Store; handling of keybag keys within the SEP
SkyLight	WindowServer; SkyLight.framework
Skywalk	network subsystem in XNU, links together actual technologies (Bluetooth, WiFi, Thunderbolt) and interfaces/tunnels; transacts in nexus (for conduits) and agent (for endpoints) objects; DriverKit network drivers use Skywalk; command line tool: skywalkctl
SLC	System-Level Cache, architectural feature of Apple Silicon; cache located within SoC at controllers for external DRAM, serves all compute units and stages transfers between them
Social Gaming	Game Center; multiplayer gaming services on top of CloudKit, shared storage and low-latency multicast for multiplayer sessions; launchd service: com.apple.gamed
Sock Puppet	Watch interaction that requires Companion iPhone
