Term	Description
SOS	Secure Object Sync; syncing backend for iCloud Keychain, not to be confused with the emergency call feature; transferred items previously staged in Synced Defaults, for two-factor accounts in CKKS; launchd services: com.apple.secd (access to local keychain), com.apple.security.cloudkeychainproxy3 (connects to Synced Defaults), com.apple.security.keychain-circle-notification
SPI	System Private Interface; /System/Library/PrivateFrameworks
SpringBoard	iOS home screen; like Dock (Launchpad, Mission Control, desktop picture), Control Center, SystemUIServer (menu extras icons), loginwindow (lock screen), and WindowServer (compositor) on macOS; /System/Library/CoreServices/SpringBoard.app, /Applications/PreBoard.app, BaseBoard.framework, FrontBoard.framework, SplashBoard.framework; launchd service: com.apple.backboardd (compositor)
SPRR	Shadow Permission Remap Register? feature of Apple Silicon to dynamically reintepret page permissions
SPTM	Secure Page Table Monitor; code in kernel-level GXF protects page table modifications; Trusted Execution Monitor (TXM) in user-level GXF implements policy and parts of AMFI
SRP	Secure Remote Password; standard cryptographic protocol for proving knowledge of a secret such that attackers cannot brute-force the secret; AppleSRP.framework
SSO	Single Sign-On
SSV	Signed System Volume, als called Authenticated Root Volume (ARV); macOS boots from blessed read-only APFS snapshot, merkle-tree and root-hash stored in Preboot volume; modifications require disabling root authentication with csrutil from recovery, then the live filesystem can be mounted, modified, and re-blessed; command line tools: apfs_systemsnapshot, bless, csrutil
Stark	CarPlay; iPhone provides video feeds for in-car displays; three layers composited by the car: remote UI (from iPhone), punch-through UI (back up camera), local UI (dashboard gauges: assets from iPhone, rendered by car, like Live Activities?), overlay UI (essential indicators); associate apps on iOS: /Applications/CarCamera.app, /Applications/Charge.app, /Applications/Climate.app, /Applications/Closures.app, /Applications/Media.app, /Applications/TirePressure.app, /Applications/Trip.app, /Applications/Vehicle.app
Stockholm	Secure Element in Apple SoCs, a processor running crypto protocols on keys it protects; used for Apple Pay and Car Key; related codenames: Icefall, Warsaw
Storage Management	freeing up disk space by managing bulky items; UI in System Information.app; StorageManagement.framework; launchd service: com.apple.diskspaced; extension point: com.apple.storagemanagement; extends Cache Delete service
Suggestions	semantic analysis of mails and websites to suggest contacts, calendar events and the like; launchd services: com.apple.suggestd, com.apple.reversetemplated; custom JavaScript parsers in /System/Library/AssetsV2/com_apple_MobileAsset_CoreSuggestions
Symbols	debug symbols for backtraces; CoreSymbolication.framework; launchd services: com.apple.coresymbolicationd; command line tools: atos, symbols, symbolscache
Symptoms	network diagnostics; Symptoms.framework; /var/networkd/db/netusage.sqlite; launchd service: com.apple.symptomsd (invoked by kernel through host special port 27)
Synced Defaults	simple key-value store for applications, no user control over data; can use iCloud key-value backend (old) or Manatee container (new, marked as com.apple.kvs) as storage; launchd service: com.apple.syncdefaultsd; locally stored in ~/Library/SyncedPreferences
System Configuration	SystemConfiguration.framework; launchd service: com.apple.configd; command line tool: scutil
System Extension	system-wide components formerly implemented as insecure plugins or kexts; current extension types: DriverKit, FSKit, Network, Endpoint Security, Core Media IO; /System/DriverKit, /System/Library/DriverExtensions, /Library/Preferences/com.apple.networkextension.plist; command line tool: systemextensionsctl; launchd services: com.apple.sysextd, com.apple.nesessionmanager, com.apple.endpointsecurity.endpointsecurityd; command line tool: eslogger
System Policy	Gatekeeper; policy engine for application launches and kext loading, malware signatures from /Library/Apple/System/Library/CoreServices/XProtect.bundle; /var/db/SystemPolicyConfiguration; launchd service: com.apple.security.syspolicy (invoked by kernel through host special port 29); command line tool: spctl
Tailspin	sampling of process stack traces; launchd service: com.apple.tailspind; command line tool: tailspin
TAL	Transparent App Lifecycle; process for macOS apps started and stopped independently of the user launching and quitting app; also handles session restore across reboots; ~/Library/Saved Application State; launchd service: com.apple.talagent
Taskport	Mach kernel concept for ptrace-like access to task internals; access policy implemented by daemon; launchd service: com.apple.taskgated (invoked by kernel through task special port 9); command line tool: DevToolsSecurity
TCC	Transparency, Consent, and Control; user control over app access to privacy-related services (kTCCService*); TCC.framework; launchd services: com.apple.tccd, com.apple.tccd.system; command line tool: tccutil; stored in /Library/Application Support/com.apple.TCC, ~/Library/Application Support/com.apple.TCC, /var/db/locationd (for kTCCServiceLocation)
Template App	code-less app-bundle, passed to an actual executable by LauncServices; created when adding websites in Safari to Dock/Springboard; run by /System/Volumes/Preboot/Cryptexes/App/System/Library/CoreServices/Web App.app
Time Machine	automatic backup service, command line tools: tmdiagnose, tmutil
Tin Can	Walkie Talkie on watchOS; /Applications/TinCan.app
Tones	ringtones; ToneLibrary.framework
Translocation	app binary copied on launch to dedicated location; initiated by Launch Services for security (prevents path traversal for apps quarantined by System Policy) or path normalization (iOS apps do not expect to be moved, but can be moved on macOS)
Transparency	un-alterable append-only log to publish information; used for for ESS keys and PCC software hashes, based on CONIKS, devices audit IDS/PCC records against logs, root hashes gossiped over iMessage to detect split-view attacks; Transparency.framework; launchd service: com.apple.transparencyd; server: init-kt.apple.com
TSS	Tatsu Signing Server; online verification for firmware signatures; server: gs.apple.com
TTS	Text To Speech, neural-network-based synthesis engine (Gryphon); command line tool: say; /System/Library/Speech
TVML	TV Markup Language; declarative UI language for TV apps; TVMLKit.framework
UARP	Universal Accessory Restore Protocol; CoreUARP.framework; launchd service: com.apple.uarppersonalizationd (personalized firmware)
Ubiquity	iCloud Drive; codename Bladerunner, uses CloudKit; CloudDocs.framework; launchd service: com.apple.bird; locally stored in ~/Library/Mobile Documents (was supposed to move to Library/CloudStorage/iCloud Drive but this was reverted)
UID	unique ID key, used as root key for cryptographic subsystems, generated during manufacturing by SEP and fused into hardware, only accessible by SEP
Unified Logging	system-wide logging and Activity tracking; launchd service: com.apple.logd, com.apple.diagnosticd; command line tool: log; /dev/oslog; data stored in /var/db/diagnostics, support files in /var/db/uuidtext
Urchin	Tides app on watchOS; /Applications/Urchin.app
USD	Universal Scene Description; storage format for 3D assets; /usr/lib/usd; command line tools: usdcat, usdchecker, usdcrush, usdextract, usdrecord, usdtree, usdzip
User Activity	abstraction for deep-linking into apps with structured context (people, places); used for Universal Links (schema.org on websites), Handoff, Parsec (app links in search), Quick Note (context awareness); now part of Intents; UserActivity.framework; launchd service: com.apple.coreservices.useractivityd
User Notifications	user interface for notification center; launchd service: com.apple.usernoted
UTI	Uniform Type Identifiers; system for document types; file extensions and MIME types are mapped to UTIs, UTIs form a conformance graph, apps register their UTIs with Launch Services; /System/Library/CoreServices/CoreTypes.bundle; also Apple’s hardware devices are represented as UTIs
VA	Video Acceleration; AppleVA.framework
VDAF	Verifiable Distributed Aggregation Function; part of Differential Privacy; VDAF.framework
Viceroy	video conferencing used by FaceTime and ReplayKit; ViceroyTrace.framework
Virtualisation	running virtual machines on macOS; Hypervisor.framework (for basic VMs and vCPUs), Virtualization.framework (brings a robust set of device models)
VSDB	volume status database; /var/db/volinfo.database; command line tool: vsdbutil
Waldo	selects edge servers based on approximate location, part of Private Relay, seen in NSP
Wally	private search in server-side database using homomorphic encryption; private information retrieval (PIR), private nearest neighbor search (PNNS); used for Caller ID, email logos, adult website filtering, points-of-interest lookup for photos
WFS	WebDAV File Sharing; built-in file sharing with Apache; /etc/wfs; command line tool: wfsctl
Widgets	content excerpt from apps; provided via a timeline of view hierarchies, configuration uses Intents; visible on home screen, lock screen, as live activities, as watch complications; WidgetKit.framework, ChronoServices.framework; extension point: com.apple.widgetkit-extension; launchd service: com.apple.chronod (timeline management and sync)
Willow	HomeKit; end-to-end-encrypted communication protocol and API for IoT-accessories; pairing with SRP using code printed on device, credential sync by CKKS, transported over Alloy, remote access using Apple TV as proxy; launchd service: com.apple.homed
Window Manager	implements Stage Manager; /System/Library/CoreServices/WindowManager.app; launchd service: com.apple.WindowManager.agent
Workflow	Shortcuts; user-programmable system-wide automation, built-in triggers cause a chain of actions to run; actions are synthesized from User Activities and Intents provided by apps; WorkflowKit.framework, ActionKit.framework; locally stored in ~/Library/Shortcuts; launchd service: com.apple.siriactionsd (voice-triggered shortcuts); command line tool: shortcuts
xART	eXtended Anti-Replay Technology; persistent storage for SEP, used by Mesa; /System/Volumes/xarts; launchd service: com.apple.xartstorageremoted; command line tool: xartutil
XCS	Xcode Server; continuous integration server; command line tools: xcscontrol, xcsdiagnose
XProtect	signature-based malware scanner and remediation service; /Library/Apple/System/Library/CoreServices/XProtect.bundle; command line tool: xprotect